{
  "$schema": "https://json-schema.org/draft/2020-12/schema",
  "$id": "https://example.com/agent-evidence/execution-evidence-operation-accountability-profile-v0.1.schema.json",
  "title": "ExecutionEvidenceOperationAccountabilityProfileV0_1",
  "type": "object",
  "additionalProperties": false,
  "required": [
    "profile",
    "statement_id",
    "timestamp",
    "actor",
    "subject",
    "operation",
    "policy",
    "constraints",
    "provenance",
    "evidence",
    "validation"
  ],
  "properties": {
    "profile": {
      "type": "object",
      "additionalProperties": false,
      "required": [
        "name",
        "version"
      ],
      "properties": {
        "name": {
          "type": "string",
          "const": "execution-evidence-operation-accountability-profile"
        },
        "version": {
          "type": "string",
          "const": "0.1"
        }
      }
    },
    "statement_id": {
      "type": "string",
      "minLength": 1
    },
    "timestamp": {
      "type": "string",
      "format": "date-time"
    },
    "actor": {
      "type": "object",
      "additionalProperties": false,
      "required": [
        "id",
        "type",
        "name",
        "runtime"
      ],
      "properties": {
        "id": {
          "type": "string",
          "minLength": 1
        },
        "type": {
          "type": "string",
          "minLength": 1
        },
        "name": {
          "type": "string",
          "minLength": 1
        },
        "runtime": {
          "type": "string",
          "minLength": 1
        }
      }
    },
    "subject": {
      "type": "object",
      "additionalProperties": false,
      "required": [
        "id",
        "type",
        "digest",
        "locator"
      ],
      "properties": {
        "id": {
          "type": "string",
          "minLength": 1
        },
        "type": {
          "type": "string",
          "minLength": 1
        },
        "digest": {
          "type": "string",
          "pattern": "^sha256:[0-9a-f]{64}$"
        },
        "locator": {
          "type": "string",
          "minLength": 1
        }
      }
    },
    "operation": {
      "type": "object",
      "additionalProperties": false,
      "required": [
        "id",
        "type",
        "subject_ref",
        "policy_ref",
        "input_refs",
        "output_refs",
        "result"
      ],
      "properties": {
        "id": {
          "type": "string",
          "minLength": 1
        },
        "type": {
          "type": "string",
          "minLength": 1
        },
        "description": {
          "type": "string"
        },
        "subject_ref": {
          "type": "string",
          "minLength": 1
        },
        "policy_ref": {
          "type": "string",
          "minLength": 1
        },
        "input_refs": {
          "type": "array",
          "minItems": 1,
          "items": {
            "type": "string",
            "minLength": 1
          }
        },
        "output_refs": {
          "type": "array",
          "minItems": 1,
          "items": {
            "type": "string",
            "minLength": 1
          }
        },
        "result": {
          "type": "object",
          "additionalProperties": false,
          "required": [
            "status",
            "summary"
          ],
          "properties": {
            "status": {
              "type": "string",
              "enum": [
                "succeeded",
                "failed"
              ]
            },
            "summary": {
              "type": "string",
              "minLength": 1
            }
          }
        }
      }
    },
    "policy": {
      "type": "object",
      "additionalProperties": false,
      "required": [
        "id",
        "name",
        "constraint_refs"
      ],
      "properties": {
        "id": {
          "type": "string",
          "minLength": 1
        },
        "name": {
          "type": "string",
          "minLength": 1
        },
        "constraint_refs": {
          "type": "array",
          "minItems": 1,
          "items": {
            "type": "string",
            "minLength": 1
          }
        }
      }
    },
    "constraints": {
      "type": "array",
      "minItems": 1,
      "items": {
        "type": "object",
        "additionalProperties": false,
        "required": [
          "id",
          "description"
        ],
        "properties": {
          "id": {
            "type": "string",
            "minLength": 1
          },
          "description": {
            "type": "string",
            "minLength": 1
          }
        }
      }
    },
    "provenance": {
      "type": "object",
      "additionalProperties": false,
      "required": [
        "id",
        "actor_ref",
        "operation_ref",
        "subject_ref",
        "input_refs",
        "output_refs"
      ],
      "properties": {
        "id": {
          "type": "string",
          "minLength": 1
        },
        "actor_ref": {
          "type": "string",
          "minLength": 1
        },
        "operation_ref": {
          "type": "string",
          "minLength": 1
        },
        "subject_ref": {
          "type": "string",
          "minLength": 1
        },
        "input_refs": {
          "type": "array",
          "minItems": 1,
          "items": {
            "type": "string",
            "minLength": 1
          }
        },
        "output_refs": {
          "type": "array",
          "minItems": 1,
          "items": {
            "type": "string",
            "minLength": 1
          }
        }
      }
    },
    "evidence": {
      "type": "object",
      "additionalProperties": false,
      "required": [
        "id",
        "subject_ref",
        "operation_ref",
        "policy_ref",
        "references",
        "artifacts",
        "integrity"
      ],
      "properties": {
        "id": {
          "type": "string",
          "minLength": 1
        },
        "subject_ref": {
          "type": "string",
          "minLength": 1
        },
        "operation_ref": {
          "type": "string",
          "minLength": 1
        },
        "policy_ref": {
          "type": "string",
          "minLength": 1
        },
        "references": {
          "type": "array",
          "minItems": 1,
          "items": {
            "type": "object",
            "additionalProperties": false,
            "required": [
              "ref_id",
              "role",
              "object_id",
              "digest",
              "locator"
            ],
            "properties": {
              "ref_id": {
                "type": "string",
                "minLength": 1
              },
              "role": {
                "type": "string",
                "enum": [
                  "input",
                  "output"
                ]
              },
              "object_id": {
                "type": "string",
                "minLength": 1
              },
              "digest": {
                "type": "string",
                "pattern": "^sha256:[0-9a-f]{64}$"
              },
              "locator": {
                "type": "string",
                "minLength": 1
              }
            }
          }
        },
        "artifacts": {
          "type": "array",
          "minItems": 1,
          "items": {
            "type": "object",
            "additionalProperties": false,
            "required": [
              "artifact_id",
              "type",
              "digest",
              "locator"
            ],
            "properties": {
              "artifact_id": {
                "type": "string",
                "minLength": 1
              },
              "type": {
                "type": "string",
                "minLength": 1
              },
              "digest": {
                "type": "string",
                "pattern": "^sha256:[0-9a-f]{64}$"
              },
              "locator": {
                "type": "string",
                "minLength": 1
              }
            }
          }
        },
        "integrity": {
          "type": "object",
          "additionalProperties": false,
          "required": [
            "references_digest",
            "artifacts_digest",
            "statement_digest"
          ],
          "properties": {
            "references_digest": {
              "type": "string",
              "pattern": "^sha256:[0-9a-f]{64}$"
            },
            "artifacts_digest": {
              "type": "string",
              "pattern": "^sha256:[0-9a-f]{64}$"
            },
            "statement_digest": {
              "type": "string",
              "pattern": "^sha256:[0-9a-f]{64}$"
            }
          }
        }
      }
    },
    "validation": {
      "type": "object",
      "additionalProperties": false,
      "required": [
        "id",
        "evidence_ref",
        "provenance_ref",
        "policy_ref",
        "validator",
        "method",
        "status"
      ],
      "properties": {
        "id": {
          "type": "string",
          "minLength": 1
        },
        "evidence_ref": {
          "type": "string",
          "minLength": 1
        },
        "provenance_ref": {
          "type": "string",
          "minLength": 1
        },
        "policy_ref": {
          "type": "string",
          "minLength": 1
        },
        "validator": {
          "type": "string",
          "minLength": 1
        },
        "method": {
          "type": "string",
          "minLength": 1
        },
        "status": {
          "type": "string",
          "enum": [
            "verifiable",
            "unverifiable"
          ]
        }
      }
    }
  }
}
