{
  "actor": {
    "id": "actor:test_result_summary:valid_test_summary:runner",
    "name": "test-summary-generator",
    "runtime": "representative-local-fixture",
    "type": "automation"
  },
  "constraints": [
    {
      "description": "Test summary must match the raw test result and release gate threshold.",
      "id": "constraint:case-rule"
    }
  ],
  "evidence": {
    "artifacts": [
      {
        "artifact_id": "artifact:operation-log",
        "digest": "sha256:323dbcb0ff2e059a1d4ab983c63696944e1a0ffd5cf3110e974b6a437cfbacfa",
        "locator": "urn:se-case:test_result_summary:valid_test_summary:operation-log",
        "type": "operation-log"
      },
      {
        "artifact_id": "artifact:policy",
        "digest": "sha256:1d53fc3ff488273d1fdbbe4c6716379327bdb608b25914c5c13c985f5e73fa1f",
        "locator": "urn:se-case:test_result_summary:valid_test_summary:policy",
        "type": "policy"
      },
      {
        "artifact_id": "artifact:evidence",
        "digest": "sha256:7650e87795f175ee419fd44f0bcf7c460ea18bff3d4f972b9d17ccfaf38473d2",
        "locator": "urn:se-case:test_result_summary:valid_test_summary:evidence",
        "type": "case-evidence"
      }
    ],
    "id": "evidence:test_result_summary:valid_test_summary",
    "integrity": {
      "artifacts_digest": "sha256:72cba4b9b63059ca90c6cab3d2ae2cec880a0c819f0fa9d81730ce7c2fcc2f14",
      "references_digest": "sha256:6bfa7e8b9d5b2e29501bcc924dc6768249e513f4868a1119e8dc3421a2934843",
      "statement_digest": "sha256:baf5b5afe1bc095b683bc006c0e9872f402890bb15792d3eaebe600b3965b8d1"
    },
    "operation_ref": "op:test_result_summary:valid_test_summary",
    "policy_ref": "policy:test_result_summary:valid_test_summary",
    "references": [
      {
        "digest": "sha256:464ed35f5a699b394d84813a071c2f17df1fa5a6327434c20b5121f96cb1bfec",
        "locator": "urn:se-case:test_result_summary:valid_test_summary:input",
        "object_id": "obj:test_result_summary:valid_test_summary:subject",
        "ref_id": "ref:input",
        "role": "input"
      },
      {
        "digest": "sha256:6aa437a9ab56173cf538dba380f76c91ef2e6a7883c90b1b74ba1cd876d3af8d",
        "locator": "urn:se-case:test_result_summary:valid_test_summary:output",
        "object_id": "obj:test_result_summary:valid_test_summary:output",
        "ref_id": "ref:output",
        "role": "output"
      }
    ],
    "subject_ref": "obj:test_result_summary:valid_test_summary:subject"
  },
  "operation": {
    "description": "Valid test-result summarization",
    "id": "op:test_result_summary:valid_test_summary",
    "input_refs": [
      "ref:input"
    ],
    "output_refs": [
      "ref:output"
    ],
    "policy_ref": "policy:test_result_summary:valid_test_summary",
    "result": {
      "status": "succeeded",
      "summary": "Valid test-result summarization"
    },
    "subject_ref": "obj:test_result_summary:valid_test_summary:subject",
    "type": "test.result_summarize"
  },
  "policy": {
    "constraint_refs": [
      "constraint:case-rule"
    ],
    "id": "policy:test_result_summary:valid_test_summary",
    "name": "test-summary-policy"
  },
  "profile": {
    "name": "execution-evidence-operation-accountability-profile",
    "version": "0.1"
  },
  "provenance": {
    "actor_ref": "actor:test_result_summary:valid_test_summary:runner",
    "id": "prov:test_result_summary:valid_test_summary",
    "input_refs": [
      "ref:input"
    ],
    "operation_ref": "op:test_result_summary:valid_test_summary",
    "output_refs": [
      "ref:output"
    ],
    "subject_ref": "obj:test_result_summary:valid_test_summary:subject"
  },
  "statement_id": "eeoap:test_result_summary:valid_test_summary",
  "subject": {
    "digest": "sha256:464ed35f5a699b394d84813a071c2f17df1fa5a6327434c20b5121f96cb1bfec",
    "id": "obj:test_result_summary:valid_test_summary:subject",
    "locator": "urn:se-case:test_result_summary:valid_test_summary:subject",
    "type": "test-run"
  },
  "timestamp": "2026-06-02T00:00:00Z",
  "validation": {
    "evidence_ref": "evidence:test_result_summary:valid_test_summary",
    "id": "validation:test_result_summary:valid_test_summary",
    "method": "schema+reference+consistency+integrity+case-adapter",
    "policy_ref": "policy:test_result_summary:valid_test_summary",
    "provenance_ref": "prov:test_result_summary:valid_test_summary",
    "status": "verifiable",
    "validator": "agent-evidence validate-profile"
  }
}
