{
  "actor": {
    "id": "actor:doc_data_transform:stale_source_hash:runner",
    "name": "doc-metadata-generator",
    "runtime": "representative-local-fixture",
    "type": "automation"
  },
  "constraints": [
    {
      "description": "Generated metadata must be derived from the current source document.",
      "id": "constraint:case-rule"
    }
  ],
  "evidence": {
    "artifacts": [
      {
        "artifact_id": "artifact:operation-log",
        "digest": "sha256:90db1c27fede30bfdcf513bd4933e9088c689e9b5536e349679255adcac161dc",
        "locator": "urn:se-case:doc_data_transform:stale_source_hash:operation-log",
        "type": "operation-log"
      },
      {
        "artifact_id": "artifact:policy",
        "digest": "sha256:0fcd70181ef56d14cfb3a25a7cf30e9ec36d22203a6795e2c096fffa7c6b4ddc",
        "locator": "urn:se-case:doc_data_transform:stale_source_hash:policy",
        "type": "policy"
      },
      {
        "artifact_id": "artifact:evidence",
        "digest": "sha256:f107934a82dbbd761ae89db40c402ba6d6c28d9fba8a273edda677558c99359f",
        "locator": "urn:se-case:doc_data_transform:stale_source_hash:evidence",
        "type": "case-evidence"
      }
    ],
    "id": "evidence:doc_data_transform:stale_source_hash",
    "integrity": {
      "artifacts_digest": "sha256:d4512f3a191cbf76708a0764449eef4faf058d456667dfdfd900e75f429264f1",
      "references_digest": "sha256:94803f286dff54a4876fca44a014be532de9edffb4efca76e331a777704081bf",
      "statement_digest": "sha256:aa28283206553fccbafbf27e1f3e273e2c4b1e1d64d60146e59e62c984834b9f"
    },
    "operation_ref": "op:doc_data_transform:stale_source_hash",
    "policy_ref": "policy:doc_data_transform:stale_source_hash",
    "references": [
      {
        "digest": "sha256:058c77663b9edf1ec2c8bdca056f3e6b06f2aa9e7e63ea3defb904fb37085f35",
        "locator": "urn:se-case:doc_data_transform:stale_source_hash:input",
        "object_id": "obj:doc_data_transform:stale_source_hash:subject",
        "ref_id": "ref:input",
        "role": "input"
      },
      {
        "digest": "sha256:06768e58d3167255b2a9508b3aebc450003ee7ac7bdb1ca4741353cb62172a3e",
        "locator": "urn:se-case:doc_data_transform:stale_source_hash:output",
        "object_id": "obj:doc_data_transform:stale_source_hash:output",
        "ref_id": "ref:output",
        "role": "output"
      }
    ],
    "subject_ref": "obj:doc_data_transform:stale_source_hash:subject"
  },
  "operation": {
    "description": "Documentation metadata generated from stale source digest",
    "id": "op:doc_data_transform:stale_source_hash",
    "input_refs": [
      "ref:input"
    ],
    "output_refs": [
      "ref:output"
    ],
    "policy_ref": "policy:doc_data_transform:stale_source_hash",
    "result": {
      "status": "succeeded",
      "summary": "Documentation metadata generated from stale source digest"
    },
    "subject_ref": "obj:doc_data_transform:stale_source_hash:subject",
    "type": "documentation.metadata_transform"
  },
  "policy": {
    "constraint_refs": [
      "constraint:case-rule"
    ],
    "id": "policy:doc_data_transform:stale_source_hash",
    "name": "documentation-metadata-policy"
  },
  "profile": {
    "name": "execution-evidence-operation-accountability-profile",
    "version": "0.1"
  },
  "provenance": {
    "actor_ref": "actor:doc_data_transform:stale_source_hash:runner",
    "id": "prov:doc_data_transform:stale_source_hash",
    "input_refs": [
      "ref:input"
    ],
    "operation_ref": "op:doc_data_transform:stale_source_hash",
    "output_refs": [
      "ref:output"
    ],
    "subject_ref": "obj:doc_data_transform:stale_source_hash:subject"
  },
  "statement_id": "eeoap:doc_data_transform:stale_source_hash",
  "subject": {
    "digest": "sha256:058c77663b9edf1ec2c8bdca056f3e6b06f2aa9e7e63ea3defb904fb37085f35",
    "id": "obj:doc_data_transform:stale_source_hash:subject",
    "locator": "urn:se-case:doc_data_transform:stale_source_hash:subject",
    "type": "source-document"
  },
  "timestamp": "2026-06-02T00:00:00Z",
  "validation": {
    "evidence_ref": "evidence:doc_data_transform:stale_source_hash",
    "id": "validation:doc_data_transform:stale_source_hash",
    "method": "schema+reference+consistency+integrity+case-adapter",
    "policy_ref": "policy:doc_data_transform:stale_source_hash",
    "provenance_ref": "prov:doc_data_transform:stale_source_hash",
    "status": "verifiable",
    "validator": "agent-evidence validate-profile"
  }
}
